{
  "name": "skillhub-sandbox",
  "owner": {
    "name": "liulejun",
    "email": "lejun.liu@memoket.ai"
  },
  "description": "[SANDBOX] 未策展、社区 PR 投稿的技能。装得到但未经安全评审，自担风险；好用且过审的会晋级进 curated 的 skillhub。",
  "version": "0.0.1",
  "plugins": [
    {
      "name": "skillhub-sandbox",
      "source": "./",
      "description": "[SANDBOX/UNREVIEWED] 社区投稿技能（仅 Inert/纯指令，无自动运行代码）。未经策展，安装前自行审阅。",
      "category": "sandbox",
      "keywords": ["sandbox", "unreviewed", "community"],
      "tags": ["unreviewed", "sandbox"]
    }
  ]
}
